<?xml version="1.0" encoding="UTF-8"?>
<xs:schema xmlns:xs="http://www.w3.org/2001/XMLSchema">

  <!--
  ==============================================================================
  Definition
  ==============================================================================
  -->

  <xs:annotation>
    <xs:appinfo>awe Actions Schema</xs:appinfo>
    <xs:documentation xml:lang="en">
      This Schema defines the way an awe Actions file must be structured
    </xs:documentation>
  </xs:annotation>

  <!--
  ==============================================================================
  Includes
  ==============================================================================
  -->

  <xs:include schemaLocation="general.xsd"/>

  <!--
  ==============================================================================
  Elements
  ==============================================================================
  -->

  <!-- Actions Element -->
  <xs:element name="actions" type="actionsType">
    <xs:unique name="ActionNameUnique">
      <xs:selector xpath=".//target" />
      <xs:field xpath="@id" />
    </xs:unique>
  </xs:element>

  <!-- Action Element -->
  <xs:element name="action" type="actionType"/>

  <!-- Call Element -->
  <xs:element name="call" type="callType"/>

  <!-- Answer Element -->
  <xs:element name="answer" type="answerType"/>

  <!-- Response Element -->
  <xs:element name="response" type="responseType"/>

  <!-- Type Element -->
  <xs:element name="type" type="xs:string"/>

  <!-- Destination Element -->
  <xs:element name="destination" type="xs:string"/>

  <!-- Async Element -->
  <xs:element name="async" type="xs:string"/>

  <!-- Silent Element -->
  <xs:element name="silent" type="xs:string"/>

  <!-- Parameters Element -->
  <xs:element name="parameters" type="parametersType"/>

  <!-- Parameter Element -->
  <xs:element name="parameter" type="parameterType"/>

  <!--
  ==============================================================================
  Attribute Groups
  ==============================================================================
  -->

  <!-- Action Attributes -->
  <xs:attributeGroup name="actionAttr">
    <xs:attribute name="format" use="required" type="xs:string"/>
    <xs:attribute name="id" use="required" type="xs:string"/>
  </xs:attributeGroup>

  <!-- Parameter Attributes -->
  <xs:attributeGroup name="parameterAttr">
    <xs:attribute name="name" use="required" type="xs:string"/>
    <xs:attribute name="value"/>
    <xs:attribute name="variable" type="xs:string"/>
    <xs:attribute name="parameter" type="xs:string"/>
  </xs:attributeGroup>

  <!--
  ==============================================================================
  Group definitions
  ==============================================================================
  -->

  <!-- Actions Group -->
  <xs:group name="actionsGroup">
    <xs:choice>
      <xs:element ref="action"/>
    </xs:choice>
  </xs:group>

  <!-- Action Group -->
  <xs:group name="actionGroup">
    <xs:sequence>
      <xs:element ref="call"   minOccurs="1" maxOccurs="1"/>
      <xs:element ref="answer" minOccurs="0" maxOccurs="unbounded"/>
    </xs:sequence>
  </xs:group>

  <!-- Answer Group -->
  <xs:group name="answerGroup">
    <xs:sequence>
      <xs:element ref="response"/>
    </xs:sequence>
  </xs:group>

  <!--
  ==============================================================================
  Type definitions
  ==============================================================================
  -->

  <!-- Actions Type -->
  <xs:complexType name="actionsType">
    <xs:group ref="actionsGroup" minOccurs="0" maxOccurs="unbounded"/>
  </xs:complexType>

  <!-- Action Type -->
  <xs:complexType name="actionType">
    <xs:group ref="actionGroup"/>
    <xs:attributeGroup ref="actionAttr"/>
  </xs:complexType>

  <!-- Call Type -->
  <xs:complexType name="callType">
    <xs:attribute name="service" use="required" type="xs:string"/>
  </xs:complexType>

  <!-- Answer Type -->
  <xs:complexType name="answerType">
    <xs:group ref="answerGroup" minOccurs="1" maxOccurs="unbounded"/>
    <xs:attribute name="type" use="required" type="xs:string"/>
  </xs:complexType>

  <!-- Response Type -->
  <xs:complexType name="responseType">
    <xs:sequence>
      <xs:element ref="type"/>
      <xs:element minOccurs="0" ref="async"/>
      <xs:element minOccurs="0" ref="silent"/>
      <xs:element minOccurs="0" ref="destination"/>
      <xs:element minOccurs="0" ref="parameters"/>
    </xs:sequence>
  </xs:complexType>

  <!-- Parameters Type -->
  <xs:complexType name="parametersType">
    <xs:sequence>
      <xs:element maxOccurs="unbounded" ref="parameter"/>
    </xs:sequence>
  </xs:complexType>

  <!-- Parameter Type -->
  <xs:complexType name="parameterType">
    <xs:attributeGroup ref="parameterAttr"/>
  </xs:complexType>

</xs:schema>
