<?xml version="1.0" encoding="UTF-8"?>

<!--
    Document   : Actions.xml
    Created on : 5 de febrero de 2010, 12:46
    Author     : Pablo GARCIA
    Description:
        Purpose of the document follows.
-->

<actions xmlns:xsi="http://www.w3.org/2001/XMLSchema-instance" xsi:noNamespaceSchemaLocation="https://aweframework.gitlab.io/awe/docs/schemas/actions.xsd">

  <!-- DEFAULT ERROR! DO NOT REMOVE -->
  <action id="DEFAULT_ERROR" format="JSON">
    <call service="NONE" />
    <answer type="error">
      <response>
        <type>end-load</type>
      </response>
      <response>
        <type>message</type>
        <parameters>
          <parameter name="type" variable="MESSAGE_TYPE" />
          <parameter name="title" variable="MESSAGE_TITLE" />
          <parameter name="message" variable="MESSAGE_DESCRIPTION" />
        </parameters>
      </response>
      <response>
        <type>cancel</type>
      </response>
    </answer>
  </action>

  <!-- LOGIN ACTION -->
  <action id="login" format="HTML">
    <call service="logout" />
  </action>

  <!-- LOGIN ACTION -->
  <action id="loginRedirect" format="JSON">
    <call service="login"/>
    <answer type="ok">
      <response>
        <type>end-load</type>
      </response>
    </answer>
    <answer type="warning">
      <response>
        <type>end-load</type>
      </response>
      <response>
        <type>message</type>
        <parameters>
          <parameter name="type" variable="MESSAGE_TYPE" />
          <parameter name="title" variable="MESSAGE_TITLE" />
          <parameter name="message" variable="MESSAGE_DESCRIPTION" />
        </parameters>
      </response>
      <response>
        <type>cancel</type>
      </response>
    </answer>
    <answer type="error">
      <response>
        <type>end-load</type>
      </response>
      <response>
        <type>message</type>
        <parameters>
          <parameter name="type" variable="MESSAGE_TYPE" />
          <parameter name="title" variable="MESSAGE_TITLE" />
          <parameter name="message" variable="MESSAGE_DESCRIPTION" />
        </parameters>
      </response>
      <response>
        <type>cancel</type>
      </response>
    </answer>
  </action>

  <!-- LOGOUT ACTION -->
  <action id="logout" format="HTML">
    <call service="logout" />
  </action>


  <!-- LOGOUT ACTION -->
  <action id="logoutRedirect" format="JSON">
    <call service="logout" />
    <answer type="ok">
      <response>
        <type>end-load</type>
      </response>
    </answer>
    <answer type="error">
      <response>
        <type>end-load</type>
      </response>
      <response>
        <type>message</type>
        <parameters>
          <parameter name="type" variable="MESSAGE_TYPE" />
          <parameter name="title" variable="MESSAGE_TITLE" />
          <parameter name="message" variable="MESSAGE_DESCRIPTION" />
        </parameters>
      </response>
      <response>
        <type>cancel</type>
      </response>
    </answer>
  </action>

  <!-- REFRESH MENU ACTION -->
  <action id="refresh-menu" format="JSON">
    <call service="refreshMenu"/>
    <answer type="ok">
      <response>
        <type>change-menu</type>
        <parameters>
          <parameter name="options" variable="MENU_OPTIONS" />
        </parameters>
      </response>
      <response>
        <type>end-load</type>
      </response>
    </answer>
    <answer type="error">
      <response>
        <type>end-load</type>
      </response>
      <response>
        <type>message</type>
        <parameters>
          <parameter name="type"   variable="MESSAGE_TYPE" />
          <parameter name="title"   variable="MESSAGE_TITLE" />
          <parameter name="message" variable="MESSAGE_DESCRIPTION" />
        </parameters>
      </response>
      <response>
        <type>cancel</type>
      </response>
    </answer>
  </action>

  <!-- MAINTAIN ACTION -->
  <action id="maintain" format="JSON">
    <call service="launchMaintain" />
    <answer type="ok">
      <response>
        <type>end-load</type>
      </response>
      <response>
        <type>message</type>
        <parameters>
          <parameter name="type" variable="MESSAGE_TYPE" />
          <parameter name="title" variable="MESSAGE_TITLE" />
          <parameter name="message" variable="MESSAGE_DESCRIPTION" />
          <parameter name="result_details" variable="MESSAGE_RESULT_DETAILS" />
        </parameters>
      </response>
    </answer>
    <answer type="warning">
      <response>
        <type>end-load</type>
      </response>
      <response>
        <type>message</type>
        <parameters>
          <parameter name="type" variable="MESSAGE_TYPE" />
          <parameter name="title" variable="MESSAGE_TITLE" />
          <parameter name="message" variable="MESSAGE_DESCRIPTION" />
        </parameters>
      </response>
      <response>
        <type>cancel</type>
      </response>
    </answer>
    <answer type="info">
      <response>
        <type>end-load</type>
      </response>
      <response>
        <type>message</type>
        <parameters>
          <parameter name="type" variable="MESSAGE_TYPE" />
          <parameter name="title" variable="MESSAGE_TITLE" />
          <parameter name="message" variable="MESSAGE_DESCRIPTION" />
        </parameters>
      </response>
    </answer>
    <answer type="error">
      <response>
        <type>end-load</type>
      </response>
      <response>
        <type>message</type>
        <parameters>
          <parameter name="type" value="error" />
          <parameter name="title" variable="MESSAGE_TITLE" />
          <parameter name="message" variable="MESSAGE_DESCRIPTION" />
        </parameters>
      </response>
      <response>
        <type>cancel</type>
      </response>
    </answer>
  </action>

  <!-- MAINTAIN SILENT ACTION -->
  <action id="maintain-silent" format="JSON">
    <call service="launchMaintain" />
    <answer type="ok">
      <response>
        <type>end-load</type>
      </response>
    </answer>
    <answer type="warning">
      <response>
        <type>end-load</type>
      </response>
      <response>
        <type>message</type>
        <parameters>
          <parameter name="type" variable="MESSAGE_TYPE" />
          <parameter name="title" variable="MESSAGE_TITLE" />
          <parameter name="message" variable="MESSAGE_DESCRIPTION" />
        </parameters>
      </response>
      <response>
        <type>cancel</type>
      </response>
    </answer>
    <answer type="info">
      <response>
        <type>end-load</type>
      </response>
      <response>
        <type>message</type>
        <parameters>
          <parameter name="type" variable="MESSAGE_TYPE" />
          <parameter name="title" variable="MESSAGE_TITLE" />
          <parameter name="message" variable="MESSAGE_DESCRIPTION" />
        </parameters>
      </response>
    </answer>
    <answer type="error">
      <response>
        <type>end-load</type>
      </response>
      <response>
        <type>message</type>
        <parameters>
          <parameter name="type" value="error" />
          <parameter name="title" variable="MESSAGE_TITLE" />
          <parameter name="message" variable="MESSAGE_DESCRIPTION" />
        </parameters>
      </response>
      <response>
        <type>cancel</type>
      </response>
    </answer>
  </action>

  <!-- MAINTAIN ASYNC ACTION (LIKE MAINTAIN SILENT, BUT WITHOUT RESPONSE) -->
  <action id="maintain-async" format="JSON">
    <call service="launchMaintain" />
  </action>

  <!-- DATA SILENT ACTION -->
  <action id="data-silent" format="JSON">
    <call service="launchQuery" />
    <answer type="ok">
      <response>
        <type>end-load</type>
      </response>
    </answer>
    <answer type="warning">
      <response>
        <type>end-load</type>
      </response>
      <response>
        <type>message</type>
        <parameters>
          <parameter name="type" variable="MESSAGE_TYPE" />
          <parameter name="title" variable="MESSAGE_TITLE" />
          <parameter name="message" variable="MESSAGE_DESCRIPTION" />
        </parameters>
      </response>
      <response>
        <type>cancel</type>
      </response>
    </answer>
    <answer type="info">
      <response>
        <type>end-load</type>
      </response>
      <response>
        <type>message</type>
        <parameters>
          <parameter name="type" variable="MESSAGE_TYPE" />
          <parameter name="title" variable="MESSAGE_TITLE" />
          <parameter name="message" variable="MESSAGE_DESCRIPTION" />
        </parameters>
      </response>
    </answer>
    <answer type="error">
      <response>
        <type>end-load</type>
      </response>
      <response>
        <type>message</type>
        <parameters>
          <parameter name="type" value="error" />
          <parameter name="title" variable="MESSAGE_TITLE" />
          <parameter name="message" variable="MESSAGE_DESCRIPTION" />
        </parameters>
      </response>
      <response>
        <type>cancel</type>
      </response>
    </answer>
  </action>

  <!-- DATA SILENT ACTION -->
  <action id="update-model" format="JSON">
    <call service="updateModel" />
    <answer type="ok">
      <response>
        <type>end-load</type>
      </response>
    </answer>
    <answer type="warning">
      <response>
        <type>end-load</type>
      </response>
      <response>
        <type>message</type>
        <parameters>
          <parameter name="type" variable="MESSAGE_TYPE" />
          <parameter name="title" variable="MESSAGE_TITLE" />
          <parameter name="message" variable="MESSAGE_DESCRIPTION" />
        </parameters>
      </response>
      <response>
        <type>cancel</type>
      </response>
    </answer>
    <answer type="info">
      <response>
        <type>end-load</type>
      </response>
      <response>
        <type>message</type>
        <parameters>
          <parameter name="type" variable="MESSAGE_TYPE" />